{
  "schema_version": 1,
  "project": {
    "name": "Example Project",
    "repo": "owner/repo",
    "canonical_branch": "main",
    "updated_at": "2026-05-08T00:00:00.000Z"
  },
  "rules": {
    "update_state_when_work_done": true,
    "valid_statuses": ["planned", "in_progress", "done", "blocked", "deferred", "superseded"],
    "release_critical_priorities": ["release-critical-now"],
    "protected_surfaces": []
  },
  "milestones": [
    { "id": "launch", "title": "Launch readiness", "status": "planned", "items": ["launch.plan"] }
  ],
  "items": [
    {
      "id": "launch.plan",
      "title": "Define launch plan",
      "status": "planned",
      "priority": "release-critical-now",
      "owner": "unassigned",
      "evidence": [],
      "success_conditions": ["Launch plan is reviewed."],
      "notes": [],
      "updated_at": "2026-05-08T00:00:00.000Z"
    }
  ]
}
