{
  "schema_version": 1,
  "project": {
    "name": "DEVPLAN Tracker Pack",
    "repo": "gpcola/cheapskate",
    "canonical_branch": "work",
    "updated_at": "2026-05-08T00:00:00.000Z"
  },
  "rules": {
    "update_state_when_work_done": true,
    "valid_statuses": [
      "planned",
      "in_progress",
      "done",
      "blocked",
      "deferred",
      "superseded"
    ],
    "release_critical_priorities": [
      "release-critical-now"
    ],
    "protected_surfaces": [
      "scripts/devplan.mjs command names",
      "DEVPLAN-STATE.json schema_version 1 compatibility"
    ]
  },
  "milestones": [
    {
      "id": "repo-pack",
      "title": "Standalone repository pack",
      "status": "done",
      "items": [
        "repo.structure",
        "cli.commands",
        "installer.safety",
        "validation.coverage",
        "docs.examples",
        "ci.tests",
        "devplan.default-layout"
      ]
    },
    {
      "id": "test-ms",
      "title": "Test milestone",
      "status": "done",
      "items": [
        "test.item"
      ]
    }
  ],
  "items": [
    {
      "id": "repo.structure",
      "title": "Create production-ready package repository structure",
      "status": "done",
      "priority": "release-critical-now",
      "owner": "codex",
      "evidence": [
        "Repository contains package metadata, license, scripts, docs, examples, schema, workflow, and tests."
      ],
      "success_conditions": [
        "Required repository files are present.",
        "The source archive has been removed after use."
      ],
      "notes": [],
      "updated_at": "2026-05-08T00:00:00.000Z"
    },
    {
      "id": "cli.commands",
      "title": "Implement dependency-free DEVPLAN CLI commands",
      "status": "done",
      "priority": "release-critical-now",
      "owner": "codex",
      "evidence": [
        "scripts/devplan.mjs supports status, validate, next, report, readiness, list, add-milestone, add-item, update, remove-item, link-item, protect, and init."
      ],
      "success_conditions": [
        "All required commands run using Node built-ins only.",
        "Wrapper scripts delegate to the main CLI."
      ],
      "notes": [],
      "updated_at": "2026-05-08T00:00:00.000Z"
    },
    {
      "id": "installer.safety",
      "title": "Provide safe installation into target repositories",
      "status": "done",
      "priority": "release-critical-now",
      "owner": "codex",
      "evidence": [
        "install.mjs skips existing files unless --force is supplied and preserves package.json scripts."
      ],
      "success_conditions": [
        "Existing target files are not overwritten by default.",
        "package.json scripts are merged when package.json exists.",
        "Manual install guidance is shown when package.json is absent."
      ],
      "notes": [],
      "updated_at": "2026-05-08T00:00:00.000Z"
    },
    {
      "id": "validation.coverage",
      "title": "Validate DEVPLAN state consistency",
      "status": "done",
      "priority": "release-critical-now",
      "owner": "codex",
      "evidence": [
        "Validation checks JSON parsing, schema_version, project metadata, statuses, unique IDs, milestone references, item fields, and DEVPLAN.md references."
      ],
      "success_conditions": [
        "Invalid state exits non-zero with useful errors.",
        "Valid state exits zero and prints readable checks."
      ],
      "notes": [],
      "updated_at": "2026-05-08T00:00:00.000Z"
    },
    {
      "id": "docs.examples",
      "title": "Document usage, governance, CI, migration, agents, and examples",
      "status": "done",
      "priority": "must-add-soon-after-release",
      "owner": "codex",
      "evidence": [
        "Documentation and SaaS, mobile app, and client website examples are included."
      ],
      "success_conditions": [
        "Agent workflow rules explain when and how to update state in PRs.",
        "Release instructions and changelog are included."
      ],
      "notes": [],
      "updated_at": "2026-05-08T00:00:00.000Z"
    },
    {
      "id": "ci.tests",
      "title": "Add automated tests and CI workflow",
      "status": "done",
      "priority": "release-critical-now",
      "owner": "codex",
      "evidence": [
        "Node test runner coverage and GitHub Actions workflow are included."
      ],
      "success_conditions": [
        "npm test passes.",
        "CI runs tests and DEVPLAN validation."
      ],
      "notes": [],
      "updated_at": "2026-05-08T00:00:00.000Z"
    },
    {
      "id": "test.item",
      "title": "Test item",
      "status": "done",
      "priority": "release-critical-now",
      "owner": "unassigned",
      "evidence": [
        "manual test"
      ],
      "success_conditions": [
        "Test success"
      ],
      "notes": [
        {
          "at": "2026-05-08T09:08:22.595Z",
          "text": "Completed"
        }
      ],
      "updated_at": "2026-05-08T09:08:22.595Z"
    },
    {
      "id": "devplan.default-layout",
      "title": "Move default installed tracker files under devplan/",
      "status": "done",
      "priority": "release-critical-now",
      "owner": "codex",
      "evidence": [
        "npm test, validate/status/readiness, and migrate --dry-run passed with devplan/ defaults."
      ],
      "success_conditions": [
        "CLI defaults use devplan/ paths.",
        "Installer creates devplan/ files and preserves them unless --force is used.",
        "Legacy root files are detected and migration can move them."
      ],
      "notes": [],
      "updated_at": "2026-05-08T00:00:00.000Z"
    }
  ]
}
