{
  "schema_version": 1,
  "project": {
    "name": "SaaS Billing Platform",
    "repo": "acme/billing-saas",
    "canonical_branch": "main",
    "updated_at": "2026-05-08T00:00:00.000Z"
  },
  "rules": {
    "update_state_when_work_done": true,
    "valid_statuses": ["planned", "in_progress", "done", "blocked", "deferred", "superseded"],
    "release_critical_priorities": ["release-critical-now"],
    "protected_surfaces": ["tenant billing isolation", "subscription webhook idempotency"]
  },
  "milestones": [
    { "id": "billing-launch", "title": "Billing launch", "status": "in_progress", "items": ["billing.checkout", "billing.webhooks"] }
  ],
  "items": [
    {
      "id": "billing.checkout",
      "title": "Implement hosted checkout flow",
      "status": "done",
      "priority": "release-critical-now",
      "owner": "payments",
      "evidence": ["npm test -- billing"],
      "success_conditions": ["Users can start a paid subscription from the app."],
      "notes": [],
      "updated_at": "2026-05-08T00:00:00.000Z"
    },
    {
      "id": "billing.webhooks",
      "title": "Process subscription webhooks idempotently",
      "status": "in_progress",
      "priority": "release-critical-now",
      "owner": "payments",
      "evidence": [],
      "success_conditions": ["Duplicate webhook deliveries do not create duplicate entitlements."],
      "notes": [],
      "updated_at": "2026-05-08T00:00:00.000Z"
    }
  ]
}
