{
  "schema_version": 1,
  "project": {
    "name": "Mobile Habit App",
    "repo": "acme/habit-mobile",
    "canonical_branch": "main",
    "updated_at": "2026-05-08T00:00:00.000Z"
  },
  "rules": {
    "update_state_when_work_done": true,
    "valid_statuses": ["planned", "in_progress", "done", "blocked", "deferred", "superseded"],
    "release_critical_priorities": ["release-critical-now"],
    "protected_surfaces": ["offline data sync", "push notification permissions"]
  },
  "milestones": [
    { "id": "app-store", "title": "App store readiness", "status": "planned", "items": ["mobile.offline-sync", "mobile.store-assets"] }
  ],
  "items": [
    {
      "id": "mobile.offline-sync",
      "title": "Validate offline sync conflict handling",
      "status": "planned",
      "priority": "release-critical-now",
      "owner": "mobile",
      "evidence": [],
      "success_conditions": ["Edits made offline reconcile without data loss after reconnect."],
      "notes": [],
      "updated_at": "2026-05-08T00:00:00.000Z"
    },
    {
      "id": "mobile.store-assets",
      "title": "Prepare app store screenshots and metadata",
      "status": "planned",
      "priority": "must-add-soon-after-release",
      "owner": "marketing",
      "evidence": [],
      "success_conditions": ["Store listing assets are ready for review submission."],
      "notes": [],
      "updated_at": "2026-05-08T00:00:00.000Z"
    }
  ]
}
